{
  "id": "evt_tool_result_1",
  "ts": "2024-01-01T00:00:02Z",
  "type": "tool_result",
  "session_id": "ganak_sess_1",
  "run_id": "ganak_run_1",
  "payload": {
    "id": "tool_call_1",
    "name": "shell.exec",
    "output": {"exit_code": 1, "stdout": "", "stderr": "fail"},
    "success": false
  }
}
